{
  "$schema": "https://json-schema.org/draft/2020-12/schema",
  "$id": "https://raw.githubusercontent.com/OpenLightingProject/open-fixture-library/master/schemas/fixture.json",

  "version": "12.5.1",

  "type": "object",
  "properties": {
    "$schema": {
      "const": "https://raw.githubusercontent.com/OpenLightingProject/open-fixture-library/master/schemas/fixture.json"
    },
    "name": {
      "description": "unique in manufacturer",
      "$ref": "definitions.json#/nonEmptyString"
    },
    "shortName": {
      "description": "unique globally; if not set: use name",
      "$ref": "definitions.json#/nonEmptyString"
    },
    "categories": {
      "type": "array",
      "description": "most important category first",
      "minItems": 1,
      "uniqueItems": true,
      "items": {
        "enum": [
          "Barrel Scanner",
          "Blinder",
          "Color Changer",
          "Dimmer",
          "Effect",
          "Fan",
          "Flower",
          "Hazer",
          "Laser",
          "Matrix",
          "Moving Head",
          "Pixel Bar",
          "Scanner",
          "Smoke",
          "Stand",
          "Strobe",
          "Other"
        ]
      }
    },
    "meta": {
      "type": "object",
      "properties": {
        "authors": {
          "type": "array",
          "minItems": 1,
          "uniqueItems": true,
          "items": { "$ref": "definitions.json#/nonEmptyString" }
        },
        "createDate": { "$ref": "definitions.json#/isoDateString" },
        "lastModifyDate": { "$ref": "definitions.json#/isoDateString" },
        "importPlugin": {
          "type": "object",
          "properties": {
            "plugin": { "$ref": "definitions.json#/nonEmptyString" },
            "date": { "$ref": "definitions.json#/isoDateString" },
            "comment": { "$ref": "definitions.json#/nonEmptyMultilineString" }
          },
          "required": ["plugin", "date"],
          "additionalProperties": false
        }
      },
      "required": ["authors", "createDate", "lastModifyDate"],
      "additionalProperties": false
    },
    "comment": { "$ref": "definitions.json#/nonEmptyMultilineString" },
    "links": {
      "type": "object",
      "properties": {
        "manual": { "$ref": "definitions.json#/urlArray" },
        "productPage": { "$ref": "definitions.json#/urlArray" },
        "video": { "$ref": "definitions.json#/urlArray" },
        "other": { "$ref": "definitions.json#/urlArray" }
      },
      "anyOf": [
        { "required": ["manual"] },
        { "required": ["productPage"] },
        { "required": ["video"] },
        { "required": ["other"] }
      ],
      "additionalProperties": false
    },
    "helpWanted": { "$ref": "definitions.json#/nonEmptyString" },
    "rdm": {
      "type": "object",
      "properties": {
        "modelId": {
          "type": "integer",
          "minimum": 0,
          "maximum": 65535
        },
        "softwareVersion": { "$ref": "definitions.json#/nonEmptyString" }
      },
      "required": ["modelId"],
      "additionalProperties": false
    },
    "physical": {
      "type": "object",
      "minProperties": 1,
      "properties": {
        "dimensions": {
          "$ref": "definitions.json#/dimensionsXYZ"
        },
        "weight": {
          "description": "in kg",
          "type": "number",
          "exclusiveMinimum": 0
        },
        "power": {
          "description": "in W",
          "type": "number",
          "exclusiveMinimum": 0
        },
        "powerConnectors": {
          "type": "object",
          "minProperties": 1,
          "additionalProperties": false,
          "properties": {
            "IEC C13": {
              "$ref": "definitions.json#/powerConnectorType"
            },
            "IEC C19": {
              "type": "string",
              "const": "input only"
            },
            "powerCON": {
              "$ref": "definitions.json#/powerConnectorType"
            },
            "powerCON TRUE1": {
              "$ref": "definitions.json#/powerConnectorType"
            },
            "powerCON TRUE1 TOP": {
              "$ref": "definitions.json#/powerConnectorType"
            },
            "powerCON 32 A": {
              "type": "string",
              "const": "input only"
            },
            "Hardwired": {
              "$ref": "definitions.json#/powerConnectorType"
            },
            "Proprietary": {
              "$ref": "definitions.json#/powerConnectorType"
            }
          }
        },
        "DMXconnector": {
          "$comment": "additions are welcome",
          "enum": [
            "3-pin",
            "3-pin (swapped +/-)",
            "3-pin XLR IP65",
            "5-pin",
            "5-pin XLR IP65",
            "3-pin and 5-pin",
            "3.5mm stereo jack",
            "RJ45"
          ]
        },
        "bulb": {
          "type": "object",
          "minProperties": 1,
          "properties": {
            "type": {
              "description": "e.g. 'LED'",
              "$ref": "definitions.json#/nonEmptyString"
            },
            "colorTemperature": {
              "description": "in K",
              "type": "number",
              "exclusiveMinimum": 0
            },
            "lumens": {
              "type": "number",
              "exclusiveMinimum": 0
            }
          },
          "additionalProperties": false
        },
        "lens": {
          "type": "object",
          "minProperties": 1,
          "properties": {
            "name": {
              "description": "e.g. 'PC', 'Fresnel'",
              "$ref": "definitions.json#/nonEmptyString"
            },
            "degreesMinMax": {
              "type": "array",
              "minItems": 2,
              "maxItems": 2,
              "items": {
                "type": "number",
                "minimum": 0,
                "maximum": 360
              }
            }
          },
          "additionalProperties": false
        },
        "matrixPixels": {
          "type": "object",
          "minProperties": 1,
          "properties": {
            "dimensions": { "$ref": "definitions.json#/dimensionsXYZ" },
            "spacing": { "$ref": "definitions.json#/dimensionsXYZ" }
          },
          "additionalProperties": false
        }
      },
      "additionalProperties": false
    },
    "matrix": { "$ref": "matrix.json#" },
    "wheels": {
      "type": "object",
      "minProperties": 1,
      "propertyNames": {
        "$comment": "wheel names",
        "$ref": "definitions.json#/nonEmptyString"
      },
      "additionalProperties": {
        "type": "object",
        "properties": {
          "direction": { "enum": ["CW", "CCW"] },
          "slots": {
            "type": "array",
            "minItems": 2,
            "items": { "$ref": "wheel-slot.json#" }
          }
        },
        "required": ["slots"],
        "additionalProperties": false
      }
    },
    "availableChannels": {
      "type": "object",
      "minProperties": 1,
      "propertyNames": {
        "$comment": "channel keys",
        "$ref": "definitions.json#/noVariablesString"
      },
      "additionalProperties": { "$ref": "channel.json#" }
    },
    "templateChannels": {
      "type": "object",
      "minProperties": 1,
      "propertyNames": {
        "$comment": "template channel keys",
        "$ref": "definitions.json#/variablePixelKeyString"
      },
      "additionalProperties": { "$ref": "channel.json#" }
    },
    "modes": {
      "type": "array",
      "minItems": 1,
      "items": {
        "type": "object",
        "properties": {
          "name": { "$ref": "definitions.json#/modeNameString" },
          "shortName": { "$ref": "definitions.json#/modeNameString" },
          "rdmPersonalityIndex": {
            "type": "integer",
            "minimum": 1
          },
          "physical": { "$ref": "#/properties/physical" },
          "channels": {
            "type": "array",
            "minItems": 1,
            "items": {
              "oneOf": [
                {
                  "$comment": "for unused channels",
                  "type": "null"
                },
                {
                  "$comment": "normal channel keys, resolved template channel keys or channel alias keys",
                  "$ref": "definitions.json#/noVariablesString"
                },
                {
                  "$comment": "matrix channel insert block",
                  "type": "object",
                  "properties": {
                    "insert": { "const": "matrixChannels" },
                    "repeatFor": {
                      "oneOf": [
                        {
                          "enum": [
                            "eachPixelABC",
                            "eachPixelXYZ",
                            "eachPixelXZY",
                            "eachPixelYXZ",
                            "eachPixelYZX",
                            "eachPixelZXY",
                            "eachPixelZYX",
                            "eachPixelGroup"
                          ]
                        },
                        {
                          "type": "array",
                          "minItems": 1,
                          "uniqueItems": true,
                          "items": {
                            "$comment": "pixel key or pixel group key",
                            "$ref": "definitions.json#/noVariablesString"
                          }
                        }
                      ]
                    },
                    "channelOrder": { "enum": ["perPixel", "perChannel"] },
                    "templateChannels": {
                      "type": "array",
                      "minItems": 1,
                      "items": {
                        "oneOf": [
                          {
                            "$comment": "for unused channels",
                            "type": "null"
                          },
                          {
                            "$comment": "template channel key or template channel alias key",
                            "$ref": "definitions.json#/variablePixelKeyString"
                          }
                        ]
                      }
                    }
                  },
                  "required": ["insert", "repeatFor", "channelOrder", "templateChannels"],
                  "additionalProperties": false
                }
              ]
            }
          }
        },
        "required": ["name", "channels"],
        "additionalProperties": false
      }
    }
  },
  "dependentRequired": {
    "matrix": ["templateChannels"],
    "templateChannels": ["matrix"]
  },
  "required": ["$schema", "name", "categories", "meta", "modes"],
  "allOf": [
    {
      "if": {
        "properties": { "modes": { "contains": { "required": ["rdmPersonalityIndex"] } } }
      },
      "then": {
        "required": ["rdm"]
      }
    },
    {
      "anyOf": [
        { "required": ["availableChannels"] },
        { "required": ["templateChannels"] }
      ]
    }
  ],
  "additionalProperties": false
}
