{
  "$schema": "https://raw.githubusercontent.com/OpenLightingProject/open-fixture-library/master/schemas/fixture.json",
  "name": "18 RGBW Wall Washers",
  "categories": ["Pixel Bar", "Color Changer", "Effect"],
  "meta": {
    "authors": ["Alex"],
    "createDate": "2024-01-01",
    "lastModifyDate": "2024-01-01"
  },
  "physical": {
    "dimensions": [945, 72, 125],
    "DMXconnector": "3-pin",
    "bulb": {
      "type": "LED"
    }
  },
  "matrix": {
    "pixelCount": [18, 1, 1],
    "pixelGroups": {
      "All": "all",
      "Section 1": ["1", "2", "3"],
      "Section 2": ["4", "5", "6"],
      "Section 3": ["7", "8", "9"],
      "Section 4": ["10", "11", "12"],
      "Section 5": ["13", "14", "15"],
      "Section 6": ["16", "17", "18"]
    }
  },
  "availableChannels": {
    "Overall Dimming": { "capability": { "type": "Intensity", "brightnessStart": "0%", "brightnessEnd": "100%" } },
    "RGBW Strobe": {
      "capabilities": [
        { "dmxRange": [0, 4], "type": "ShutterStrobe", "shutterEffect": "Open" },
        { "dmxRange": [5, 255], "type": "ShutterStrobe", "shutterEffect": "Strobe", "speedStart": "slow", "speedEnd": "fast" }
      ]
    },
    "Red": { "capability": { "type": "ColorIntensity", "color": "Red", "brightnessStart": "0%", "brightnessEnd": "100%" } },
    "Green": { "capability": { "type": "ColorIntensity", "color": "Green", "brightnessStart": "0%", "brightnessEnd": "100%" } },
    "Blue": { "capability": { "type": "ColorIntensity", "color": "Blue", "brightnessStart": "0%", "brightnessEnd": "100%" } },
    "White": { "capability": { "type": "ColorIntensity", "color": "White", "brightnessStart": "0%", "brightnessEnd": "100%" } },
    
    "Auxiliary Light White Dimming": { "capability": { "type": "ColorIntensity", "color": "White", "brightnessStart": "0%", "brightnessEnd": "100%" } },
    "Auxiliary Light Strobe": {
      "capabilities": [
        { "dmxRange": [0, 4], "type": "ShutterStrobe", "shutterEffect": "Open" },
        { "dmxRange": [5, 255], "type": "ShutterStrobe", "shutterEffect": "Strobe", "speedStart": "slow", "speedEnd": "fast" }
      ]
    },
    
    "RGBW Built-in Effects": {
      "capabilities": [
        { "dmxRange": [0, 2], "type": "NoFunction" },
        { "dmxRange": [3, 210], "type": "Effect", "effectName": "Built-in effects (every 7 values an effect)" },
        { "dmxRange": [211, 255], "type": "Effect", "effectName": "Sound Control Effect", "soundControlled": true }
      ]
    },
    "RGBW Effect Speed": {
      "capabilities": [
        { "dmxRange": [0, 127], "type": "EffectSpeed", "speedStart": "slow", "speedEnd": "fast", "comment": "Forward" },
        { "dmxRange": [128, 255], "type": "EffectSpeed", "speedStart": "slow", "speedEnd": "fast", "comment": "Reverse" }
      ]
    },
    
    "Auxiliary Light Effect": {
      "capabilities": [
        { "dmxRange": [0, 3], "type": "NoFunction" },
        { "dmxRange": [4, 255], "type": "Effect", "effectName": "White Auxiliary light effect" }
      ]
    },
    "Auxiliary Light Effect Speed": {
      "capabilities": [
        { "dmxRange": [0, 127], "type": "EffectSpeed", "speedStart": "slow", "speedEnd": "fast", "comment": "Forward" },
        { "dmxRange": [128, 255], "type": "EffectSpeed", "speedStart": "slow", "speedEnd": "fast", "comment": "Reverse" }
      ]
    },
    
    "RGBW Background Color": { "capability": { "type": "ColorPreset", "colors": ["#000000"] } },
    "RGBW Background Tone Light": { "capability": { "type": "Intensity", "brightnessStart": "0%", "brightnessEnd": "100%" } },
    
    "RGBW1 Dimming": { "capability": { "type": "Intensity", "brightnessStart": "0%", "brightnessEnd": "100%" } },
    "RGBW2 Dimming": { "capability": { "type": "Intensity", "brightnessStart": "0%", "brightnessEnd": "100%" } },
    "RGBW3 Dimming": { "capability": { "type": "Intensity", "brightnessStart": "0%", "brightnessEnd": "100%" } },
    "RGBW4 Dimming": { "capability": { "type": "Intensity", "brightnessStart": "0%", "brightnessEnd": "100%" } },
    "RGBW5 Dimming": { "capability": { "type": "Intensity", "brightnessStart": "0%", "brightnessEnd": "100%" } },
    "RGBW6 Dimming": { "capability": { "type": "Intensity", "brightnessStart": "0%", "brightnessEnd": "100%" } },
    
    "White1 Auxiliary Light Dimming": { "capability": { "type": "ColorIntensity", "color": "White", "brightnessStart": "0%", "brightnessEnd": "100%" } },
    "White2 Auxiliary Light Dimming": { "capability": { "type": "ColorIntensity", "color": "White", "brightnessStart": "0%", "brightnessEnd": "100%" } },
    "White3 Auxiliary Light Dimming": { "capability": { "type": "ColorIntensity", "color": "White", "brightnessStart": "0%", "brightnessEnd": "100%" } },
    "White4 Auxiliary Light Dimming": { "capability": { "type": "ColorIntensity", "color": "White", "brightnessStart": "0%", "brightnessEnd": "100%" } },
    "White5 Auxiliary Light Dimming": { "capability": { "type": "ColorIntensity", "color": "White", "brightnessStart": "0%", "brightnessEnd": "100%" } },
    "White6 Auxiliary Light Dimming": { "capability": { "type": "ColorIntensity", "color": "White", "brightnessStart": "0%", "brightnessEnd": "100%" } },
    "White7 Auxiliary Light Dimming": { "capability": { "type": "ColorIntensity", "color": "White", "brightnessStart": "0%", "brightnessEnd": "100%" } },
    "White8 Auxiliary Light Dimming": { "capability": { "type": "ColorIntensity", "color": "White", "brightnessStart": "0%", "brightnessEnd": "100%" } },
    "White9 Auxiliary Light Dimming": { "capability": { "type": "ColorIntensity", "color": "White", "brightnessStart": "0%", "brightnessEnd": "100%" } },
    "White10 Auxiliary Light Dimming": { "capability": { "type": "ColorIntensity", "color": "White", "brightnessStart": "0%", "brightnessEnd": "100%" } },
    "White11 Auxiliary Light Dimming": { "capability": { "type": "ColorIntensity", "color": "White", "brightnessStart": "0%", "brightnessEnd": "100%" } },
    "White12 Auxiliary Light Dimming": { "capability": { "type": "ColorIntensity", "color": "White", "brightnessStart": "0%", "brightnessEnd": "100%" } },
    "White13 Auxiliary Light Dimming": { "capability": { "type": "ColorIntensity", "color": "White", "brightnessStart": "0%", "brightnessEnd": "100%" } }
  },
  "templateChannels": {
    "R$pixelKey": { "capability": { "type": "ColorIntensity", "color": "Red", "brightnessStart": "0%", "brightnessEnd": "100%" } },
    "G$pixelKey": { "capability": { "type": "ColorIntensity", "color": "Green", "brightnessStart": "0%", "brightnessEnd": "100%" } },
    "B$pixelKey": { "capability": { "type": "ColorIntensity", "color": "Blue", "brightnessStart": "0%", "brightnessEnd": "100%" } },
    "W$pixelKey": { "capability": { "type": "ColorIntensity", "color": "White", "brightnessStart": "0%", "brightnessEnd": "100%" } }
  },
  "modes": [
    {
      "name": "5 Channel",
      "shortName": "5ch",
      "channels": [
        "Red",
        "Green",
        "Blue",
        "White",
        "Auxiliary Light White Dimming"
      ]
    },
    {
      "name": "14 Channel",
      "shortName": "14ch",
      "channels": [
        "Overall Dimming",
        "RGBW Strobe",
        "Red",
        "Green",
        "Blue",
        "White",
        "RGBW Built-in Effects",
        "RGBW Effect Speed",
        "Auxiliary Light Strobe",
        "Auxiliary Light White Dimming",
        "Auxiliary Light Effect",
        "Auxiliary Light Effect Speed",
        "RGBW Background Color",
        "RGBW Background Tone Light"
      ]
    },
    {
      "name": "33 Channel",
      "shortName": "33ch",
      "channels": [
        "Overall Dimming",
        "RGBW Strobe",
        "Red",
        "Green",
        "Blue",
        "White",
        "RGBW1 Dimming",
        "RGBW2 Dimming",
        "RGBW3 Dimming",
        "RGBW4 Dimming",
        "RGBW5 Dimming",
        "RGBW6 Dimming",
        "RGBW Built-in Effects",
        "RGBW Effect Speed",
        "Auxiliary Light Strobe",
        "Auxiliary Light White Dimming",
        "White1 Auxiliary Light Dimming",
        "White2 Auxiliary Light Dimming",
        "White3 Auxiliary Light Dimming",
        "White4 Auxiliary Light Dimming",
        "White5 Auxiliary Light Dimming",
        "White6 Auxiliary Light Dimming",
        "White7 Auxiliary Light Dimming",
        "White8 Auxiliary Light Dimming",
        "White9 Auxiliary Light Dimming",
        "White10 Auxiliary Light Dimming",
        "White11 Auxiliary Light Dimming",
        "White12 Auxiliary Light Dimming",
        "White13 Auxiliary Light Dimming",
        "Auxiliary Light Effect",
        "Auxiliary Light Effect Speed",
        "RGBW Background Color",
        "RGBW Background Tone Light"
      ]
    },
    {
      "name": "37 Channel",
      "shortName": "37ch",
      "channels": [
        {
          "insert": "matrixChannels",
          "repeatFor": ["1", "2", "3", "4", "5", "6"],
          "channelOrder": "perPixel",
          "templateChannels": ["R$pixelKey", "G$pixelKey", "B$pixelKey", "W$pixelKey"]
        },
        "White1 Auxiliary Light Dimming",
        "White2 Auxiliary Light Dimming",
        "White3 Auxiliary Light Dimming",
        "White4 Auxiliary Light Dimming",
        "White5 Auxiliary Light Dimming",
        "White6 Auxiliary Light Dimming",
        "White7 Auxiliary Light Dimming",
        "White8 Auxiliary Light Dimming",
        "White9 Auxiliary Light Dimming",
        "White10 Auxiliary Light Dimming",
        "White11 Auxiliary Light Dimming",
        "White12 Auxiliary Light Dimming",
        "White13 Auxiliary Light Dimming"
      ]
    }
  ]
}
